<?xml version="1.0" encoding="utf-8"?>
<!DOCTYPE quiz[
    <!ELEMENT quiz (disciplina, professor, turma, data, questões)>
    <!ATTLIST quiz versao CDATA #REQUIRED>
    <!ELEMENT disciplina (#PCDATA)>
    <!ELEMENT professor (nome, matrícula?)>
        <!ELEMENT nome (#PCDATA)>
        <!ELEMENT matrícula (#PCDATA)>
    <!ELEMENT turma (#PCDATA)>
    <!ELEMENT data (#PCDATA)>
    <!ELEMENT questões (questão+)>
        <!ELEMENT questão (enunciado, pontuação, alternativas)>
            <!ELEMENT enunciado (#PCDATA)>
            <!ELEMENT pontuação (#PCDATA)>
            <!ELEMENT alternativas (alternativa+)>
                <!ELEMENT alternativa (#PCDATA)>
                    <!ATTLIST alternativa correta (sim|nao) #REQUIRED>
]>


<quiz versao="1.0">
    <disciplina>Matemática</disciplina>
    <professor>
        <nome>Dr. João Silva</nome>
        <matrícula>123456</matrícula>
    </professor>
    <turma>Turma A</turma>
    <data>2023-10-01</data> 
    <questões>
        <questão>
            <enunciado>Qual é a raiz quadrada de 16?</enunciado>
            <pontuação>2</pontuação>
            <alternativas>
                <alternativa correta="sim">4</alternativa>
                <alternativa correta="nao">5</alternativa>
                <alternativa correta="nao">6</alternativa>
                <alternativa correta="nao">7</alternativa>
            </alternativas>
        </questão>

        <questão>
            <enunciado>Qual é o valor de π (pi) aproximadamente?</enunciado>
            <pontuação>2</pontuação>
            <alternativas>
                <alternativa correta="nao">2.14</alternativa>
                <alternativa correta="sim">3.14</alternativa>
                <alternativa correta="nao">3.41</alternativa>
                <alternativa correta="nao">3.15</alternativa>
            </alternativas>
        </questão>
        <questão>
            <enunciado> Qual a cor do céu?</enunciado>
            <pontuação>2</pontuação>
            <alternativas>
                <alternativa correta="sim">Azul</alternativa>
                <alternativa correta="nao">Verde</alternativa>
                <alternativa correta="nao">Vermelho</alternativa>
                <alternativa correta="nao">Amarelo</alternativa>
            </alternativas>
        </questão>
        <questão>
            <enunciado>Qual é a fórmula da água?</enunciado>
            <pontuação>2</pontuação>
            <alternativas>
                <alternativa correta="nao">CO2</alternativa>
                <alternativa correta="sim">H2O</alternativa>
                <alternativa correta="nao">O2</alternativa>
                <alternativa correta="nao">N2</alternativa>
            </alternativas>
        </questão>
        <questão>
            <enunciado>Qual é a capital da França?</enunciado>
            <pontuação>2</pontuação>
            <alternativas>
                <alternativa correta="nao">Londres</alternativa>
                <alternativa correta="sim">Paris</alternativa>
                <alternativa correta="nao">Berlim</alternativa>
                <alternativa correta="nao">Madrid</alternativa>
            </alternativas>
        </questão>
    </questões>
</quiz>        
        
